10508;BOLSITO VIAJERO (esponja-toallas x 50 ultra-mamadera-biberón-vasito decorado);0;685,00;7798038313324
10521;SUPER BIBERON (biberón DL/vasito decorado/jabon glicerinado/cepillo limpia mamad./sonajero/peine/cuchara/tenedor);12;685,00;7798038314437
60015;PP-PLATO TERMICO DECORADO INVOLCABLE CON CUBIERTOS - SUPER OFERTA;;690,00;7798038318084
10612;PLATO TERMICO DECORADO INVOLCABLE CON CUBIERTOS;22;695,00;7798038310880
11803;PROTECTOR DE LLUVIA PARA COCHECITOS CON VENTANAS;35;699,00;7798038311894
11344;SALIDA DE BAÑO INFANTIL - Talles Pequeño/Mediano;25;699,00;7798038312822
22007;CUBRE COLCHON 2 PLAZAS - Medida: 1,90 x 1,40 x 0,20;20;715,00;7798038312006
11816;BAÑERA PLASTICA STD - 24 LITROS;6;715,00;7798038317698
10730;COLCHÓN DE ESPUMA ANTIDESLIZANTE ;0;725,00;7798038318831
10843;SACA LECHE DE SILICONAS CON BASE;0;725,00;7798038318954
11361;CAMBIADOR SUPER CON BORDES Y COBERTURA CRISTAL-En Cm.Ancho 37 Largo  Altura: centro , bordes;1;725,00;7798038319647
11906;CANASTO TRAMADO + BANDEJA;0;737,00;7798345760569
10906;CINTA PORTA CHUPETE CON BROCHE ESTAMPADO x 6 unid.;100;785,00;7798038311269
10544;MAMADERA MAXI CON ACCESORIOS (mamadera DL/biberón DL/vasito decorado/sonajero/esponja);6;785,00;7798038317834
11322;BOLSO CON CAMBIADOR ESTAMPADO Y CON COBERTURA CRISTAL;20;795,00;7798038312792
11386;SALIDA DE BAÑO INFANTIL - Talles Grande/Extra Grande;20;799,00;7798038310620
20012;CUBRE COLCHON 2 PLAZAS Y MEDIA - Medida:  x  x ;20;799,00;7798345760491
10905;CADENA PORTA CHUPETE CON BROCHE ESTAMPADO x 6 unid.;100;825,00;7798038311252
11842;BACINILLA CARITA CON TAPA;0;849,00;7798038318619
10670;PLATO TERMICO CON SENSOR DE TEMPERATURA Y CUCHARA - En caja;0;885,00;7798038318947
10933;CADENA GRUESA CON BROCHE - ANIMALITO CON FORMA x 9 unid.;100;890,00;7798038317872
10547;NUEVA CANASTA DE BAÑO (toallitas x 50 ultra/shampoo/cr.enjuague/jabón líquido/alcohol en gel/1 jabón/2 esponja familiar/1 sonajero);0;895,00;7798345760507
11907;SILLITA INFANTIL SUPER REFORZADA;0;895,00;7798345760576
10546;BIBERON MEGA (vaso con pajita/toallas x50 ultra/toallita de mano/shampo/crema enjuague/jabón glicerinado/jabonera/esponja/sonajero);6;920,00;7798038318961
11393;MOCHILA PORTA BEBE DE JEAN;20;930,00;7798038317049
11829;SOPORTE PARA BAÑO DEL BEBE;0;940,00;7798038314765
11359;BOLSO CON CAMBIADOR DE JEAN Y CON CUELLO;20;975,00;7798038315267
10536;SUPER OSITO DE ACCESORIOS (mamadera/biberon/vasito decorado/shampoo/portachupetes/esponja/sonajero);6;995,00;7798038310125
10534;SUPER OSITO DE PERFUMERIA (shampoo/crema enj./jabón líquido/mamadera osito/vasito decorado/sonajero);6;995,00;7798038317247
10837;BOLSAS CONTENEDORAS PARA LECHE MATERNA - Por 30 unidades;0;999,00;7798038318596
11372;BOLSO CON CAMBIADOR DE JEAN CON APLIQUE;15;1080,00;7798038315991
11791;JABON DE GLICERINA CON ESENCIAS x 90 grs. - LA CAJA POR 16 UNIDADES;1;1080,00;7798345760453
11790;JABON DE GLICERINA NEUTRO x 90 grs. - LA CAJA POR 16 UNIDADES;1;1080,00;7798345760460
11831;BACINILLA SUPER MULTIFUNCION;3;1100,00;7798038311931
10512;CANASTA PORTACOSMETICOS CON PERFUMERIA (toallitas x 50 ultra/shampoo/cr.enjuague/colonia/alcohol en gel/1 jabon/esponja bebé/algodón/jabonera);0;1150,00;7798038310774
10510;MAMADERA GIGANTE CON ACCESORIOS (mamadera osito/mamadera DL/Toallitas x 50 ultra/vasito decorado/jabón/jabonera/shampoo/peine/cepillo limpia mamadera/chupete/sonajero/esponja/porta mamadera);6;1175,00;7798038310804
11823;BAÑERA PLASTICA 2D - DOS DIMENSIONES - CON DESAGOTE - 28 LITROS;6;1180,00;7798038315465
11843;BACINILLA SILLITA BICOLOR;0;1190,00;7798038318626
60001;PP-MAMADERA GIGANTE CON ACCESORIOS (mamadera peppa/biberón peppa/Toallitas humedecidas/vasito decorado/jabonera/cepillo limpia mamadera/babero estampado/esponja/porta mamadera/fécula);6;1240,00;7798038317964
10830;SACA LECHE ERGONOMICO DE EXTRACCION SIMPLE - CON MAMADERA TONALIZADA;9;1285,00;7798038312235
10835;SACA LECHE ERGONOMICO DE EXTRACCION SIMPLE - CON MAMADERA DE VIDRIO;9;1285,00;7798038317704
10511;MAMADERA GIGANTE CON PERFUMERIA (shampoo/cr.enjuague/colonia/aceite/jabón líquido/2 jabones/toallitas x 50 ultra/esponja/vasito decorado/porta mamadera);6;1325,00;7798038313331
11920;ORGANIZADOR MAXI CON TAPA Y RUEDAS - 52x39x32  cm.;0;1360,00;7798345760224
19904;BOLSA DE REGALO PARA USO MULTIPLE - Pack x 50 unid.;0;1450,00;7798038312983
10542;MAMADERA GIGANTE - SET DE HIGIENE INFANTIL (toallón/toallita de mano/shampo/cr.enjuague/jabón/jabonera/alcohol en gel/cepillo/peine/esponja);6;1450,00;7798038317711
11353;ALMOHADON MULTIFUNCION - IDEAL PARA AMAMANTAMIENTO Y DESCANSO;0;1490,00;7798038319104
11332;COLCHON PARA CUNA  DE 0,60 x 1,20 x 0,08 STD;1;1520,00;7798038317056
11348;COLCHON PARA CUNA  DE 0,70 x 1,00 x 0,08 STD;1;1520,00;7798038317643
19905;BOLSA DE REGALO PARA MAMADERA GIGANTE - Pack x 50 unid.;10;2150,00;7798038312990
