10734;CEPILLO LIMPIA MAMADERA CON MANGO ROTATIVO MAS LIMPIA TETINAS;0;345;7798038319036
11653;CHIFLES DECORADOS - Bolsa por 5 unidades;0;685;7798038319043
10301;DISPITA - ALGODON SUPER X 100 grs.;40;125;7798038310545
10302;DISPITA - ALGODON SUPER X 200 grs.;20;269;7798038310552
10303;DISPITA - ALGODON SUPER X 500 grs.;10;629;7798038310569
10306;DISPITA - APOSITO POST PARTO CON DOBLE PROTECCION x 10 unid.;12;195;7798038310729
10308;PROTECTOR MAMARIO x 30 unid.;12;299;7798038310743
10310;DISPITA - GASA NRO 1 de 10 x 10 cm. x 2 sobres 16 u.;80;95;7798038316950
10312;DISPITA - GASA NRO 5 de 10 x 10 cm. x 10 sobres 16 u.;36;375;7798038316936
10402;TOALLAS HUMEDAS DISPITA - REPUESTO x 100 unid. - CON MANZANILLA - Celeste;24;139;7798038310040
10403;TOALLAS HUMEDAS DISPITA - TUBO x 100 unid. - CON MANZANILLA - Celeste;12;275;7798038310071
10407;TOALLAS HUMEDAS DISADUL - ULTRAGRUESAS PARA LA HIGIENE DIARIA x 40 unid.;12;265;7798038314154
10409;TOALLAS HUMEDAS DISPITA - REPUESTO x 100 unid. - CON LANOLINA Y VITAMINA E - Anaranjada;24;139;7798038315830
10410;TOALLAS HUMEDAS DISPITA - REPUESTO x 100 unid. - CON CALENDULA  Y VITAMINA A - Roja y Blanca;24;139;7798038315847
10411;TOALLAS HUMEDAS DISPITA - REPUESTO x 100 unid. - CON ALOE VERA Y VITAMINA E - Verde;24;139;7798038315854
10416;PAÑUELOS DESCARTABLES - 6 paquetes x 10 unidades;48;138;7798038316172
10420;TOALLAS HUMEDAS DISPITA - ULTRA GRUESAS x 50 unid.;24;169;7798038316912
10422;TOALLAS HUMEDAS DISADUL - PARA LA HIGIENE DIARIA x 60 unid.;12;299;7798038317216
10423;TOALLAS HUMEDAS DISPITA - OSITO x 100 unid.;12;338;7798038317315
10424;TOALLAS HUMEDAS DISPITA - CON CAJA CONTENEDORA - ULTRA GRUESAS x 50 unid.;11;368;7798038315922
10425;TOALLAS HUMEDAS DISPITA - REPUESTO ECONOMICO x 120 unid. - CON MANZANILLA - Celeste;24;145;7798038311955
10426;PAÑUELOS DESCARTABLES - Caja x 75 unidades;48;118;7798038312471
10429;PAÑOS JABONOSOS DESCARTABLES - DINICLEAN - 10 unidades de 20 x 20 cm.;20;345;7290016533033
10508;BOLSITO VIAJERO (esponja/toallas x 50 ultra/mamadera DL/biberón DL/vasito decorado);0;1250;7798038313324
10510;MAMADERA GIGANTE CON ACCESORIOS (mamadera osito/mamadera DL/Toallitas x 50 ultra/vasito decorado/jabón/jabonera/shampoo/peine/cepillo limpia mamadera/chupete/sonajero/esponja/porta mamadera);6;2220;7798038310804
10511;MAMADERA GIGANTE CON PERFUMERIA (shampoo/cr.enjuague/colonia/aceite/jabón líquido/2 jabones/toallitas x 50 ultra/esponja/vasito decorado/porta mamadera);6;2350;7798038313331
10512;CANASTA PORTACOSMETICOS CON PERFUMERIA (toallitas x 50 ultra/shampoo/cr.enjuague/colonia/alcohol en gel/1 jabon/esponja bebé/algodón/jabonera);0;1890;7798038310774
10513;ESTUCHE DE REGALO CON ACCESORIOS (babero estamp. /vasito decorado /pta.chupetes/chupete);8;1250;7798038312259
10521;SUPER BIBERON (biberón DL/vasito decorado/jabon glicerinado/cepillo limpia mamad./sonajero/peine/cuchara/tenedor);12;1150;7798038314437
10523;ESTUCHE DE REGALO CON CONFECCIONES (Manta de interlock/Babero/Gorrito de algodón);0;1250;7798038313089
10524;SET DE ALIMENTACION (plato playo/plato hondo/vasito decorado/cuchara/tenedor/sonajero/babero);36;999;7798038314291
10534;SUPER OSITO DE PERFUMERIA (shampoo/crema enj./jabón líquido/mamadera osito/vasito decorado/sonajero);6;1680;7798038317247
10536;SUPER OSITO DE ACCESORIOS (mamadera/biberon/vasito decorado/shampoo/portachupetes/esponja/sonajero);6;1680;7798038310125
10543;SET OSITO MINI (vaso decor./cepillo p-pelo/peine/cepillo de uñas/jabon glicerinado/sonajero);10;999;7798038317803
10544;MAMADERA MAXI CON ACCESORIOS (mamadera DL/biberón DL/vasito decorado/sonajero/esponja);6;1320;7798038317834
10546;BIBERON MEGA (mamadera DL/toallas x50 ultra/toallita de mano/shampo/crema enjuague/jabón glicerinado/jabonera/esponja/sonajero);6;1490;7798038318961
10547;NUEVA CANASTA DE BAÑO (toallitas x 50 ultra/shampoo/cr.enjuague/jabón líquido/alcohol en gel/1 jabón/2 esponja familiar/1 sonajero);0;1390;7798345760507
10602;CUCHARA Y TENEDOR DE PLASTICO DECORADO;0;195;7798038310835
10604;CUCHARA DE SILICONAS CON PUNTA RECTA;0;245;7798038312631
10605;CUCHARA DE ACERO INOXIDABLE;0;215;7798038310309
10609;PLATO HONDO DECORADO C/SUCCION Y C/CUBIERTOS;0;425;7798038310859
10610;JUEGO DE PLATOS PLAYO Y HONDO DECORADOS CON SUCCION Y CUBIERTOS CON BABERO DE REGALO;0;795;7798038310866
10611;PLATO TERMICO INVOLCABLE CON CUBIERTOS;22;985;7798038310873
10613;PORTA MAMADERA DECORADO;40;189;7798038310897
10614;PORTA MAMADERA CON FUNDA PLASTICA;28;299;7798038310903
10616;RALLADOR PARA ALIMENTOS;0;235;7798038310927
10618;VASO DECORADO PARA JUGO;128;179;7798038310934
10619;VASO DECORADO TRASLUCIDO DOBLE ASA CON SORBITO;72;315;7798038310965
10623;VASO DECORADO TRASLUCIDO PARA JUGO;128;185;7798038310989
10628;CUCHARA DE SILICONAS CON PUNTA CURVA;0;245;7798038317506
10647;VASO DECORADO ANTIDERRAME CON TAPA A ROSCA Y SORBITO;0;385;7798038316196
10652;VASO DECORADO ANTIDERRAME CON TAPA A ROSCA Y PAJITA DE SILICONAS;0;438;7798038317032
10655;VASO DE APRENDIZAJE CON AGARRE Y TETINA DE SILICONAS x 250 ml.;30;395;7798038317667
10657;VASO DE APRENDIZAJE CON ANTIDESLIZANTE Y TETINA DE SILICONAS x 240 ml.;30;395;7798038317940
10658;VASO ANTIDERRAME CON ANTIDESLIZANTE Y PAJITA DE SILICONAS x 240 ml.;38;385;7798038317933
10660;VASO ANTIDERRAME CON AGARRE Y TRABA x 260 ml.;0;998;7798038318299
10661;PLATO CON TAPA, SUCCION Y CUCHARA INCORPORADA;0;595;7798038318350
10662;DOSIFICADOR DE LECHE EN POLVO/ALIMENTOS DE 3 PISOS;0;725;7798038318442
10666;PLATO CON AGARRE Y CON PISADOR;0;685;7798038318701
10668;CUCHARA AUTO ADMINISTRABLE DE SILICONAS CON RECARGA;0;1100;7798038318909
10670;PLATO TERMICO CON SENSOR DE TEMPERATURA Y CUCHARA - En caja;0;1690;7798038318947
10671;PLATO PLAYO DECORADO C/CUBIERTOS;0;425;7798345760019
10676;CUBIERTOS DE APRENDIZAJE FLEXIBLES - CUCHARA Y TENEDOR;0;695;7798345760323
10677;VASO 360 ANTIDERRAME Y CON AGARRE x 210 ml.;0;1250;7798345760354
10679;CUCHARA CUBIERTA DE SILICONAS;0;435;7798345760866
10702;PINZA AGARRA MAMADERA ANTIDESLIZANTE;100;110;7798038311030
10703;CEPILLO DE DIENTES/MASAJEADOR DE SILICONAS PARA BEBES;200;195;7798038311047
10704;CEPILLO LIMPIA MAMADERA;100;265;7798038311054
10705;CEPILLO LIMPIA MAMADERA Y TETINA;100;365;7798038311061
10706;CEPILLO Y PEINE;84;395;7798038310378
10707;ESPONJA ANATOMICA FAMILIAR;80;99;7798038311078
10708;ESPONJA CON FORMA PARA BEBE;100;99;7798038311085
10709;JABONERA PLASTICA;0;99;7798038313409
10711;SENSOR DE TEMPERATURA PARA BAÑERA - PEZ;0;589;7798038311115
10716;PEINE PARA BEBE - Por 12 unidades;1000;790;7798038314307
10718;CEPILLO DE DIENTES INFANTIL;0;145;7798038315069
10721;COLCHON FLOTADOR PARA BAÑAR AL BEBE;0;789;7798038316035
10727;KIT DE HIGIENE DENTAL - CEPILLO + PASTA DENTAL x 100 grs.;0;235;7798038318336
10730;COLCHÓN DE ESPUMA ANTIDESLIZANTE ;0;995;7798038318831
10733;CEPILLO INTEGRADO LIMPIA MAMADERA Y TETINA CON ESPONJA Y BASE CON SUCCION;0;465;7798038319005
10735;CEPILLO LIMPIA TETINAS;0;89;7798038319111
10737;BAÑERA PLASTICA STD - 22 LITROS;6;925;7798345760637
10756;JABONERA PLASTICA DE DOS PIEZAS;0;99;7798345760026
10760;KIT DE HIGIENE - (toallón/shampoo/crema enj./baño liq./jabón/jabonera/esponja);0;2425;7798345760897
10801;ASPIRADOR NASAL CON DOS PICOS;250;235;7798038311122
10802;ASPIRADOR NASAL CON VALVULA Y 2 REPUESTOS;250;235;7798038311139
10805;MORDILLO REFRIGERANTE OSO STD;200;175;7798038310392
10806;MORDILLO BLANDO OSO/LEON;200;149;7798038311160
10809;REDUCTOR DE INODORO;24;475;7798038311177
10811;SACA LECHE STD;90;225;7798038313454
10812;SACA LECHE CON BIBERON;0;525;7798038311191
10822;PROTECTOR/AIREADOR PARA PEZONES (2 juegos);24;375;7798038314161
10824;MORDILLO CON CHIFLE ABEJITA;130;275;7798038314789
10825;REDUCTOR DE INODORO CON AGARRE, RESPALDO Y GUIAS AJUSTABLES;22;925;7798038315120
10829;SACA LECHE DE DOBLE CILINDRO;0;540;7798038316042
10830;SACA LECHE ERGONOMICO DE EXTRACCION SIMPLE - CON MAMADERA TONALIZADA;9;2390;7798038312235
10832;SACA LECHE CON BOMBA;24;985;7798038313461
10833;MORDILLO REFRIGERANTE MANITOS;110;215;7798038317452
10834;MORDILLO REFRIGERANTE OSITO;70;215;7798038317520
10835;SACA LECHE ERGONOMICO DE EXTRACCION SIMPLE - CON MAMADERA DE VIDRIO;9;2390;7798038317704
10837;BOLSAS CONTENEDORAS PARA LECHE MATERNA - Por 30 unidades;0;1850;7798038318596
10839;PINZA EXTRACTORA DE USO MULTIPLE;0;149;7798038318633
10840;MORDILLO REFRIGERANTE ELEFANTITO;0;215;7798038318688
10842;FORMADOR DE PEZON;0;395;7798038318732
10843;SACA LECHE/RECOLECTOR DE LECHE DE SILICONAS CON BASE;0;1350;7798038318954
10849;GUANTE MORDILLO MASAJEADOR - De siliconas/Facilita la dentición;0;795;7798345760477
10850;KIT DE LACTANCIA/BASE PLASTICA (saca leche ergonom./mamadera boca ancha plast./prot.mamario (6)/bolsas contened.(4)/protector (2)/aireador (2)/formador(2)/pezonera de silic.(2)/toallita de mano/cepillo limpia mamad./valija multiuso);0;4750;7798345760736
10851;KIT DE LACTANCIA/BASE VIDRIO (saca leche ergonom./mamadera boca ancha de vidrio/prot.mamario (6)/bolsas contened.(4)/protector (2)/aireador (2)/formador(2)/pezonera de silic.(2)/toallita de mano/cepillo limpia mamad./valija multiuso);0;4750;7798345760743
10852;KIT DE LACTANCIA/SACA LECHE-RECOLECTOR (saca leche-recolector de siliconas/mamadera boca ancha plast./prot.mamario (6)/bolsas contened.(4)/protector (2)/aireador (2)/formador(2)/pezonera de silic.(2)/toallita de mano/cepillo limpia mamad./valija multiuso);0;4150;7798345760750
10853;MORDILLO REFRIGERANTE HAMBURGUESA;200;175;7798345760767
10855;MORDILLO DE SILICONAS JIRAFITA;0;720;7798345760859
10905;CADENA PORTA CHUPETE CON BROCHE ESTAMPADO x 6 unid.;100;1380;7798038311252
10907;CADENA FINA PORTA CHUPETE - EN BLISTER - 1 unidad;0;110;7798038314222
10919;CADENA FINA PORTA CHUPETE x 9 unid.;100;765;7798038311238
10920;CADENA GRUESA PORTA CHUPETE x 9 unid.;100;765;7798038311245
10923;CADENA GRUESA PORTA CHUPETE - EN BLISTER - 1 unidad;0;110;7798038311276
10927;CADENA PORTA CHUPETE CON BROCHE ESTAMPADO - Blister x 1 unidad;0;310;7798038310637
10931;CINTA PORTA CHUPETES CON MINIPELUCHE DE TELA - Cajita x 1 unidad;93;399;7798038312198
10934;CINTA PORTA CHUPETE CON BROCHE REFORZADO - Blister x 1 unidad;100;235;7798038318763
10938;GANCHO PORTA BOLSAS MULTI USO REFORZADO - Hasta 20 Kgs.- Por 2 unidades;0;495;7798038319678
11001;BIBERON - PEQUEÑAS DOSIS DE VIDRIO CON TETINA DE SILICONAS x 100 ml.;0;189;7798038314314
11002;BIBERON DL ESTAMPADO CON TETINA DE SILICONAS x 125 ml.;60;310;7798038312655
11003;BIBERON AGUJERITO ESTAMPADO CON TETINA DE SILICONAS x 125 ml.;60;325;7798038312662
11004;BIBERON C/AGARRE ESTAMPADO CON TETINA DE SILICONAS x 125 ml.;0;348;7798038311344
11008;MAMADERA DL ESTAMPADA CON TETINA DE SILICONAS x 250 ml.;48;335;7798038312679
11009;MAMADERA AGUJERITO ESTAMPADA CON TETINA DE SILICONAS x 250 ml.;40;345;7798038312686
11010;MAMADERA OSITO x 250 ml.;40;345;7798038310385
11011;MAMADERA CON AGARRE ESTAMPADA CON TETINA DE SILICONAS x 250 ml.;36;375;7798038311399
11012;BIBERON - PEQUEÑAS DOSIS DE PLASTICO CON TETINA DE SILICONAS x 100 ml.;0;189;7798345760422
11016;MAMADERA TERMICA CON TETINA DE SILICONAS;0;950;7798038311306
11019;MAMADERA DE VIDRIO TEMPLADO STD CON TETINA DE SILICONAS x 250 ml.;15;549;7798038314024
11020;MAMADERA ANATOMICA ESTAMPADA CON TETINA DE SILICONAS x 250 ml.;48;345;7798038314383
11023;BIBERON ANATOMICO ESTAMPADO CON TETINA DE SILICONAS x 125 ml.;66;310;7798038314802
11026;MAMADERA DE BOCA ANCHA ESPECIAL DE SILICONAS C/TETINA DE SILICONAS x 240 cc.;0;895;7798038312112
11027;MAMADERA ANGULAR x 330 ml. TRANSPARENTE;0;525;7798038312105
11032;MAMADERA DX ESTAMPADA CON TETINA DE SILICONAS x 250 ml.;48;335;7798038313119
11034;MAMADERA DE BOCA ANCHA DE VIDRIO TEMPLADO CON TETINA DE SILICONAS x 250 ml;12;345;7798038317612
11036;MAMADERA DE BOCA ANCHA CON ANTIDESLIZANTE Y TETINA DE DE SILICONAS x 240 ml. TONALIZADA;30;310;7798038317926
11040;BIBERON DE VIDRIO TEMPLADO RFZ CON TETINA DE SILICONAS x 120 ml.;0;465;7798038318381
11050;MAMADERA DE BOCA ANCHA RENO CON TETINA DE SILICONAS Y AGARRE ANTIDESLIZANTE x 250 ml.;0;1100;7798345760330
11057;MAMADERA DE BOCA ANCHA ESTAMPADA CON TETINA DE DE SILICONAS x 250 ml. TONALIZADA;30;348;7798345760392
11105;CHUPETE DE SILICONAS COLOR - ANATOMICO - En blister - T.1/2;130;249;7798038312303
11106;CHUPETE DE SILICONAS COLOR - REDONDO - En blister - T.1/2;130;249;7798038312297
11109;CHUPETE DECORADO CON TETINA DE SILICONAS ANATOMICO - En blister;130;218;7798038310415
11110;CHUPETE DECORADO CON TETINA DE SILICONAS REDONDO - En blister;130;218;7798038313546
11111;CHUPETE LUMINOSO CON TETINA DE SILICONAS ANATOMICO - En blister;130;210;7798038312402
11112;CHUPETE LUMINOSO CON TETINA DE SILICONAS REDONDO - En blister;130;210;7798038313553
11117;PEZONERA DE SILICONAS - Por 2 unidades;0;348;7798038311450
11119;TETINA DE SILICONA CHICA/MEDIANA/GRANDE - En blister;0;165;7798038310446
11120;TETINA DE SILICONA - Por 4 unidades - En Blister;0;345;7798038312716
11121;TETINA DE SILICONA PARA MAMADERA DE BOCA ANCHA - Por 2 unidades en blister;0;299;7798038311481
11124;CHUPETE DE SILICONAS TRANSPARENTE - ANATOMICO - En blister - T.1/2/3;130;365;7798038313935
11125;CHUPETE DE SILICONAS TRANSPARENTE - REDONDO - En blister - T.1/2/3;130;365;7798038313942
11127;ESTUCHE PROTECTOR PORTA CHUPETE;0;325;7798038314796
11139;TETINA PARA JUGO DE SILICONAS -  Estuche Por 2 unidades;93;345;7798038312143
11148;CHUPETE CARITAS CON TETINA DE SILICONAS - ANATOMICO CON CAPUCHON - En blister;0;375;7798038318398
11151;CHUPETE ALIMENTADOR CON RED;0;715;7798038318657
11152;REPUESTO DE RED PARA ALIMENTADOR x 4 unidades;0;748;7798038318725
11154;CHUPETE CARITAS CON TETINA DE SILICONAS - REDONDO CON CAPUCHON - En blister;0;375;7798038318770
11155;CHUPETE BICOLOR CON TETINA DE SILICONAS ANATÓMICO - Blister - T.1/2;0;172;7798038318824
11156;CHUPETE BICOLOR CON TETINA DE SILICONAS REDONDO - Blister - T.1/2;0;172;7798038318848
11157;CHUPETE DE SILICONAS DE UNA SOLA PIEZA CON CINTA Y BROCHE PORTA CHUPETE - REDONDO - En blister - Talle único;0;575;7798038318893
11161;CHUPETE CON FLUJO DE AIREACION CON TETINA DE SILICONAS - ANATOMICO - En blister;0;395;7798038318992
11162;CHUPETE CON FLUJO DE AIREACION CON TETINA DE SILICONAS - REDONDO - En blister;0;395;7798038319029
11167;PROTECTOR DE PEZÓN ALIMENTADOR CON TETINA DE SILICONAS INTEGRADA;0;399;7798345760347
11201;ALICATE PARA BEBE CON SOPORTE DE SEGURIDAD;0;345;7798038311498
11202;TIJERITA PARA BEBE;300;398;7798038311504
11203;CEPILLITO PARA LAS UÑAS  - Ballena y Pato;0;275;7798038312723
11204;SET DE TIJERITA, ALICATE, CEPILLITO Y LIMA - En Blister;0;975;7798038311528
11207;TIJERITA PARA BEBE CON MANGO PLASTICO;300;458;7798038318251
11208;SET DE TIJERITA, ALICATE Y LIMA - En Blister;0;715;7798038317902
11210;ALICATE PARA BEBE;0;310;7798345760446
11211;CEPILLITO PARA LAS UÑAS  - Tren - Tortuga - Vaquita S.A.;0;175;7798345760729
11301;ALMOHADITA OSITO - MODELO NUEVO;20;365;7798038313591
11302;ALMOHADITA RECIEN NACIDO - NUEVO MODELO;30;345;7798038311566
11303;BABERO SIN MANGAS ATADO ATRAS;150;245;7798038312730
11304;BOLSO CON CAMBIADOR ESTAMPADO REFORZADO CON COBERTURA CRISTAL;20;1550;7798345760873
11306;BABERO MEDIANO;300;149;7798038310262
11307;BABERO MEDIANO BORDADO;300;210;7798038311597
11308;BABERO GRANDE;200;182;7798038310279
11309;BABERO GRANDE BORDADO;200;258;7798038311603
11313;BABERO CON CUELLO;200;275;7798038310255
11314;BABERO CON CUELLO BORDADO;200;330;7798038311627
11315;BABERO CON MANGAS;100;395;7798038310248
11316;MOISES DE VIAJE DE JEAN;20;4580;7798038311634
11317;BABERO REDONDO CON ABROJO;100;199;7798038312334
11319;ALMOHADITA ESTAMPADA - 4 NUEVOS MODELOS;0;365;7798038313096
11320;BABERO CON MANGAS TAMAÑO EXTRA GRANDE;100;440;7798038317285
11322;BOLSO CON CAMBIADOR ESTAMPADO CON COBERTURA CRISTAL;20;1390;7798038312792
11326;CAMBIADOR PLASTICO ESTAMPADO;28;265;7798038310293
11327;CAMBIADOR CON VOLADOS;20;485;7798038311658
11328;CAMBIADOR SUPER CON BORDES DE PROTECCIÓN-En Cm.Ancho 37 Largo 58 Altura: centro 3,6 bordes 12,5;1;1100;7798038313607
11329;CAMBIADOR DE JEAN CON BORDADO;35;475;7798038312204
11332;COLCHON PARA CUNA  DE 0,60 x 1,20 x 0,08 STD;1;2750;7798038317056
11333;ALMOHADITA VAQUITA - MODELO NUEVO;20;365;7798038313164
11336;MEDIAS PARA BEBE;0;399;7798038312037
11337;MOCHILA PORTA BEBE;30;1180;7798038311702
11341;TOALLON CON CAPUCHA BORDADO OSITO;30;1250;7798038317438
11342;PORTA ENFANT;10;985;7798038311719
11343;BABERO PLASTICO ATADO ATRÁS ESTAMPADO;0;285;7798038318213
11344;SALIDA DE BAÑO INFANTIL - Talles Pequeño/Mediano;25;1280;7798038312822
11345;BABERO PLASTICO GRANDE ESTAMPADO CON BOLSILLO RECOLECTOR;0;320;7798038318190
11346;TOALLON CON CAPUCHA ESTAMPADA;30;975;7798038311726
11348;COLCHON PARA CUNA  DE 0,70 x 1,00 x 0,08 STD;1;2750;7798038317643
11350;TOALLON EXTRA GRANDE CON CAPUCHA;0;1050;7798038318497
11351;TOALLON DE COLOR CON CAPUCHA;30;1050;7798038318268
11352;ALMOHADITA CON CUELLO PARA DESCANSO;0;525;7798038319098
11353;ALMOHADON MULTIFUNCION - IDEAL PARA AMAMANTAMIENTO Y DESCANSO;0;2650;7798038319104
11354;BABERO BANDANA ESTAMPADO;0;365;7798038318275
11356;TOALLITA DE MANO 20 X 30;0;110;7798038314321
11359;BOLSO CON CAMBIADOR DE JEAN Y CON CUELLO;20;1650;7798038315267
11361;CAMBIADOR SUPER CON BORDES Y COBERTURA CRISTAL-En Cm.Ancho 37 Largo  Altura: centro , bordes;1;1290;7798038319647
11363;BABERO CON CUELLO Y MINIPELUCHE;100;415;7798038313171
11365;BABITA COMBINADA POR 5 UNIDADES;0;235;7798038319685
11366;BABERO CON CUELLO CON APLIQUE;150;355;7798038315595
11370;MANTA PARA BEBE DE INTERLOCK;40;625;7798038315908
11373;GORRITO DE ALGODÓN;0;189;7798038316103
11375;TOALLON DE COLOR CON CAPUCHA + ESPONJA Y BOLSA PLASTICA DE REGALO DE REGALO;0;1050;7798038316295
11376;ALMOHADITA ANATOMICA;50;315;7798038316264
11378;MEDIAS PARA BEBE LABRADAS;0;399;7798038313188
11384;CAMBIADOR CON TRABA;28;485;7798038317575
11386;SALIDA DE BAÑO INFANTIL - Talles Grande/Extra Grande;20;1450;7798038310620
11387;CAMBIADOR CON APLIQUE;20;485;7798038316691
11393;MOCHILA PORTA BEBE DE JEAN;20;1620;7798038317049
11397;PROTECTOR DE SUEÑOS - EN DOS PIEZAS;20;990;7798038316929
11605;SONAJERO CUNERO PELOTITAS;0;295;7798038316110
11606;SONAJERO CUNERO ELEFANTITOS;0;365;7798038310361
11607;SONAJERO CUNERO PAJARITOS;0;365;7798038311856
11614;SONAJERO DE MANO OSITO;0;249;7798038316448
11615;SONAJERO DE MANO ELEFANTE;0;249;7798038316455
11617;SONAJERO DE MANO PERRITO;0;249;7798038316479
11618;SONAJERO DE MANO VAQUITA;0;249;7798038316486
11649;SONAJERO FORMITAS;0;189;7798038317445
11701;ACEITE x 225 ml.;12;325;7798038310231
11702;COLONIA CON VALVULA ATOMIZADORA x 225 ml. - Suave Fragancia;12;295;7798038310200
11703;COLONIA CON VALVULA ATOMIZADORA x 225 ml. - Dulce Fragancia;12;295;7798038313195
11704;CREMA ENJUAGUE x 225 ml.;12;198;7798038310224
11705;SHAMPOO x 225 ml.;12;198;7798038310217
11708;JABON CON GLICERINA LIQUIDO x 225 ml.;12;186;7798038310538
11709;JABON CON GLICERINA LIQUIDO CON VALVULA ATOMIZADORA x 225 ml.;0;225;7798038312532
11712;JABON DE GLICERINA x 90 grs.;36;110;7798038314970
11713;JABON GLICERINADO x 90 grs.;60;82;7798038314987
11718;OLEO CALCAREO x 250 ml. ;12;155;7798038311863
11719;OLEO CALCAREO x 500 ml. ;12;238;7798038311870
11720;OLEO CALCAREO x 1 litro ;6;365;7798038311887
11721;OLEO CALCAREO CON ALOE VERA x 250 ml. ;12;172;7798038313768
11722;OLEO CALCAREO CON ALOE VERA x 500 ml. ;12;262;7798038313775
11723;OLEO CALCAREO CON ALOE VERA x 1 litro;6;392;7798038313782
11724;PASTA DENTAL PARA NIÑOS Sabor Tutti Frutti - Pomo x 100 grs.;0;155;7798038313911
11726;ALCOHOL EN GEL - Repuesto en Doy Pack x 220 cc.;0;139;7798038314451
11739;ALCOHOL EN GEL x 225 ml. con Tapa;0;169;7798038316370
11747;COLONIA CON TAPA x 225 ml. - Suave Fragancia;12;258;7798038316868
11748;COLONIA CON TAPA x 225 ml. - Dulce Fragancia;12;258;7798038316875
11749;ALCOHOL EN GEL x 250 ml. con Tapa;35;182;7798038317100
11750;ALCOHOL EN GEL x 250 ml. con Válvula;35;218;7798038317094
11751;ALCOHOL EN GEL x 225 ml. con Válvula;0;195;7798038317124
11753;ALCOHOL EN GEL x 100 ml. con Tapa;24;127;7798038317186
11755;PEINE DE ACERO PARA PIOJOS CON LUPA;0;685;7798038317322
11780;GEL ANTIBACTERIAL PARA MANOS x 30 ml. - Con cubierta de siliconas;0;129;7798038317728
11782;CREMA ENJUAGUE CON VALVULA ATOMIZADORA x 225 ml.;0;238;7798345760118
11784;SHAMPOO CON VALVULA ATOMIZADORA x 225 ml.;12;238;7798345760095
11785;SHAMPOO CON AVENA x 225 ml.;12;198;7798038318244
11786;SHAMPOO CON AVENA CON VALVULA ATOMIZADORA x 225 ml.;12;238;7798345760033
11787;DIFUSOR AROMATIZANTE x 100 cc.;0;195;7798345760071
11790;JABON DE GLICERINA NEUTRO x 90 grs. - LA CAJA POR 16 UNIDADES;1;1540;7798345760460
11803;PROTECTOR DE LLUVIA PARA COCHECITOS CON VENTANAS;35;1250;7798038311894
11809;BACINILLA DECORADA;0;545;7798038312860
11810;BACINILLA AUTITO;0;625;7798038311917
11811;BACINILLA SAPITO;0;625;7798038311924
11816;BAÑERA PLASTICA STD - 24 LITROS;6;1590;7798038317698
11823;BAÑERA PLASTICA 2D - DOS DIMENSIONES - CON DESAGOTE - 28 LITROS;6;2250;7798038315465
11825;PROTECTOR DE LLUVIA PARA COCHECITOS STD;30;1100;7798038316011
11826;BACINILLA CON MANGO;22;289;7798038316271
11831;BACINILLA SUPER MULTIFUNCION;3;1950;7798038311931
11841;BACINILLA OSITO;0;625;7798038312068
11901;CANASTA CON MANIJA;0;159;7798345760514
11903;CAJONCITO PORTA OBJETOS CON TAPA SIMIL RATAN;0;335;7798345760538
11905;CANASTO TRAMADO;0;578;7798345760552
11906;CANASTO TRAMADO + BANDEJA;0;865;7798345760569
11907;SILLITA INFANTIL SUPER REFORZADA;0;1080;7798345760576
11908;BANQUITO PLEGABLE PARA NIÑOS - TAMAÑO  MINI - 285x215x210 cm.;0;1050;7798345760194
11918;ORGANIZADOR MEDIANO CON TAPA Y CIERRE RETRACTIL - 25x19x18 cm.;0;475;7798345760583
11919;ORGANIZADOR GRANDE CON TAPA Y CIERRE RETRACTIL - 30x23x22 cm.;0;578;7798345760590
11920;ORGANIZADOR MAXI CON TAPA Y RUEDAS - 52x39x32  cm.;0;1650;7798345760224
11924;BANQUITO PLEGABLE PARA NIÑOS - TAMAÑO MEDIO - 285x215x260 cm.;0;1120;7798345760705
11930;BANQUITO PLEGABLE PARA NIÑOS - TAMAÑO  MAXI - 285x215x320 cm.;0;1250;7798345760712
19902;BOLSA DE REGALO PARA MAMADERA GIGANTE - Pack x 12 unid.;30;495;7798038310781
19905;BOLSA DE REGALO PARA MAMADERA GIGANTE - Pack x 50 unid.;10;1950;7798038312990
20206;DISADUL - TOALLAS PARA INCONTINENCIA URINARIA LEVE x 10 unid.;12;189;7798038312563
20212;DISADUL - C/Gel grande x 20 unid.;6;829;7798038316806
20213;DISADUL - C/Gel extra grande x 20 unid.;6;899;7798038316813
20305;DISADUL - REFUERZA PAÑAL x 10 unid.;12;215;7798038310705
22001;BOMBACHA PLASTICA PARA ADULTOS NRO. 1 - CHICA;100;410;7798038311979
22002;BOMBACHA PLASTICA PARA ADULTOS NRO. 2 - MEDIANA;100;410;7798038311979
22003;BOMBACHA PLASTICA PARA ADULTOS NRO. 3 - GRANDE;100;468;7798038311986
22004;BOMBACHA PLASTICA PARA ADULTOS NRO. 4 - EXTRA GRANDE;100;468;7798038311986
22006;CUBRE COLCHON 1 PLAZA - Medida: 1,90 x 0,80 x 0,20;30;1030;7798038311993
22007;CUBRE COLCHON 2 PLAZAS - Medida: 1,90 x 1,40 x 0,20;20;1270;7798038312006
22012;CUBRE COLCHON 2 PLAZAS Y MEDIA - Medida:  x  x ;20;1385;7798345760491
31203;LIMA TREBOL POR 3 unid.;0;215;7798038316127
60003;PP-TOALLAS HUMEDAS - DOY PACK CON FORMA x 80 unid.;24;139;7798038317971
60004;PP-TOALLAS HUMEDAS - ULTRA GRUESAS x 50 unid.;24;169;7798038317995
60005;PP-VASO DECORADO TRASLUCIDO PARA JUGO;54;195;7798038318183
60008;PP-VASO DECORADO ANTIDERRAME CON TAPA A ROSCA Y SORBITO;0;405;7798038318176
60012;PP-CHUPETE DECORADO CON TETINA DE SILICONAS ANATOMICO;0;228;7798038318114
60014;PP-PORTA MAMADERA DECORADO;40;198;7798038318091
60015;PP-PLATO TERMICO DECORADO INVOLCABLE CON CUBIERTOS;0;1188;7798038318084
60016;PP-CEPILLO Y PEINE;0;414;7798038318077
60017;PP-TOALLON CON CAPUCHA ESTAMPADA;25;1023;7798038318060
60019;PP-ALMOHADITA ESTAMPADA;20;383;7798038318053
60020;PP-CAMBIADOR CON APLIQUE;20;509;7798038318046
60021;PP-BABERO MEDIANO;0;156;7798038318008
60022;PP-BABERO GRANDE;0;191;7798038318015
60023;PP-BABERO CON CUELLO;0;288;7798038318022
70001;LGZ-MAMADERA GIGANTE CON ACCESORIOS (mamadera lgz/biberón lgz/Toallitas humedecidas/vasito decorado/jabonera/babero estampado/esponja/porta mamadera);0;2330;7798345760606
70003;LGZ-TOALLAS HUMEDAS - ULTRA GRUESAS x 50 unid.;0;177;7798345760613
70004;LGZ-TOALLAS HUMEDAS - DOY PACK x 100 unid.;0;145;7798345760675
70005;LGZ-BIBERON ESTAMPADO CON TETINA DE SILICONAS x 125 ml.;0;325;7798345760682
70006;LGZ-MAMADERA ESTAMPADA CON TETINA DE SILICONAS x 250 ml.;0;349;7798345760699
70008;LGZ-VASO DECORADO TRASLUCIDO DOBLE ASA CON TETINA DE SILICONAS;0;425;7798345760620
70009;LGZ-PORTA MAMADERA DECORADO;0;198;7798345760804
70011;LGZ-ALMOHADITA ESTAMPADA;0;385;7798345760811
70012;LGZ-TOALLON CON CAPUCHA ESTAMPADA;0;1025;7798345760828
70013;LGZ-BABERO MEDIANO;0;156;7798345760781
70014;LGZ-BABERO GRANDE;0;191;7798345760798
70015;LGZ-BABERO CON CUELLO;0;288;7798345760774
70016;LGZ-BABERO CON MANGAS;0;414;7798345760903
70017;LGZ-BABERO BANDANA ESTAMPADO;0;383;7798345760910
70018;LGZ-SHAMPOO x 225 ml.;0;207;7798345760644
70019;LGZ-CREMA ENJUAGUE x 225 ml.;0;207;7798345760651
70021;LGZ-JABON LIQUIDO X 225 ml.;0;195;7798345760668
70022;LGZ-KIT DE HIGIENE - (toallón/shampoo/crema enj./baño liq./jabón/jabonera/esponja);0;2546;7798345760880
